{
  "topic_id": "PIT-MODERN-2026-DOGE-MUSK-EXPOSURE",
  "topic_name": "DOGE, the FY2026 budget, and Musk federal legal exposure",
  "entry_status": "review",
  "jurisdiction": "United States federal government",
  "time_window": "2024-2026",
  "created_date": "2026-07-15",
  "last_reviewed": "2026-07-16",
  "related_standard": "standards/political-influence-tree-standard.md",
  "related_annotation": "assessments/2026-07-doge-budget-musk-federal-legal-exposure.md",
  "surface_claim": {
    "claim_text": "DOGE did not materially reduce aggregate federal spending and federal matters affecting Musk companies received a clustered set of favorable or enforcement-weakening outcomes while Musk served as a special government employee.",
    "exact_quote_available": false,
    "speaker_or_institution": "Compiled narrative assessment",
    "office_or_role": "Repository-submitted research record",
    "date": "2026-07-15",
    "venue": "Executive Rhetoric Ledger",
    "jurisdiction": "United States",
    "source_url": "https://github.com/StegVerse-Labs/Executive_Rhetoric_Ledger/blob/main/assessments/2026-07-doge-budget-musk-federal-legal-exposure.md",
    "source_type": "secondary-analysis",
    "transcript_available": false,
    "archive_url": ""
  },
  "claimed_justification": {
    "category": "efficiency-fraud-reduction-and-government-reorganization",
    "stated_basis": "DOGE actions were publicly justified as fraud reduction, waste reduction, efficiency improvement, and government downsizing.",
    "quoted_basis": "Exact claim-level statements and DOGE ledger entries remain to be installed as primary receipts.",
    "implied_basis": "Agency reductions and enforcement changes were treated as components of a broader efficiency program."
  },
  "factual_basis": {
    "evidence_posture": "official-fraud-and-budget-source-classes-installed-exact-period-and-causal-records-required",
    "primary_records": [
      "18 U.S.C. § 208 statutory text",
      "GAO government-wide fraud-loss estimate and methodology limitations",
      "GPO FY2026 presidential budget proposal collection",
      "Treasury Monthly Treasury Statement collection authority and data definition",
      "Federal court dockets and agency matter records remain required",
      "Exact FY2025 actual and FY2026 period values, enacted appropriations, obligations, and comparable CBO records remain required"
    ],
    "administrative_data": [],
    "court_records": [
      "Reuters reported in May 2026 that the SEC and Musk proposed a $1.5 million settlement that the district judge had not yet approved"
    ],
    "budget_records": [
      "SRC-GOVINFO-BUDGET-2026 establishes the FY2026 presidential proposal collection only",
      "SRC-TREASURY-MTS-COLLECTION-001 establishes the official Treasury receipts, outlays, and deficit reporting source but not yet exact period values"
    ],
    "enforcement_records": [],
    "independent_analysis": [
      "Narrative assessment submitted July 15, 2026"
    ],
    "expert_testimony": [],
    "official_investigations": [
      "SRC-GAO-24-105833 provides a government-wide retrospective fraud-loss range and methodological limits; it is not agency-level or predictive"
    ],
    "unsupported_assertions": [
      "A final finding that Musk caused each favorable disposition",
      "A final finding of corrupt purpose",
      "A final finding that no historical precedent exists",
      "A conclusion that a § 208 waiver existed or did not exist"
    ],
    "contradictions": [
      "Broad policy-change explanations may account for some agency actions independently of Musk-specific benefit",
      "Temporal clustering supports inquiry but does not independently prove particular-matter participation or corrupt purpose",
      "Requested, enacted, obligated, and expended budget amounts must not be treated as interchangeable",
      "The FY2026 presidential budget proposal cannot establish enacted or actual spending"
    ],
    "missing_records": [
      "Musk appointment instrument and SGE designation",
      "Ethics agreement, recusals, and any 18 U.S.C. § 208(b) waiver",
      "Current court and agency disposition records for every listed matter",
      "DOGE savings ledger versions, methodology, correction history, and realized-savings records",
      "Exact FY2025 actual and FY2026 period values, enacted appropriations, obligations, and comparable CBO records",
      "Comparable prior-administration and non-beneficiary controls"
    ]
  },
  "influence_lineage": {
    "influence_posture": "executive-advisory-and-agency-action-lineage-incomplete",
    "known_origin_points": [
      "Creation and operation of the United States DOGE Service",
      "Musk service as a special government employee",
      "Pre-existing federal investigations and enforcement matters involving Musk companies"
    ],
    "institutional_amplifiers": ["White House", "DOGE", "DOJ", "SEC", "NLRB", "FAA", "DOL", "NHTSA", "federal inspectors general"],
    "media_amplifiers": ["Reuters and other contemporaneous reporting"],
    "legal_networks": [],
    "funding_or_donor_links": ["America PAC matters remain a separate but related research branch"],
    "policy_documents": ["18 U.S.C. § 208", "SGE appointment and ethics instruments not yet collected"],
    "academic_or_expert_sources": [],
    "lobbying_channels": [],
    "party_or_campaign_documents": [],
    "religious_or_cultural_institutions": [],
    "activist_organizations": [],
    "foreign_influence_indicators": [],
    "unknown_nodes": [
      "Decision chain for each agency action affecting a Musk entity",
      "Whether Musk personally and substantially participated in any particular matter",
      "Existence and scope of any conflict-of-interest waiver"
    ]
  },
  "action_conversion": {
    "authority_posture": "official-role-confirmed-specific-participation-unresolved",
    "action_type": "government reorganization, workforce reduction, enforcement disposition, and budget reallocation",
    "instrument": "Executive, administrative, litigation, personnel, and appropriations instruments require claim-level collection",
    "instrument_url": "",
    "date": "2025-2026",
    "actor": "Multiple executive-branch and independent-agency officials; Musk-specific participation unresolved",
    "enforcing_entity": "Multiple federal entities",
    "implementation_status": "Several actions and dispositions are publicly reported; complete causal and authority reconstruction is pending",
    "affected_population_or_program": "Federal workforce, regulated entities, benefit programs, enforcement functions, and Musk-affiliated companies"
  },
  "control_comparison": {
    "required": true,
    "status": "framework-installed-partially-sourced-controls-unpopulated",
    "comparable_red_jurisdictions": [],
    "comparable_blue_jurisdictions": [],
    "comparable_prior_administrations": [],
    "comparable_policy_instruments": ["Prior SGE conflict waivers and recusals"],
    "comparable_fraud_or_harm_magnitude": [
      "GAO estimated a government-wide annual fraud-loss range using FY2018-FY2022 data; the source prohibits agency-level attribution and prediction"
    ],
    "comparable_enforcement_tools": ["Agency-wide enforcement reductions affecting unrelated regulated entities"],
    "comparable_judicial_posture": ["Administration-transition dismissals or settlements without beneficiary government service"],
    "missing_controls": [
      "Prior SGEs whose companies faced active federal matters",
      "Broad agency reductions with no official-beneficiary overlap",
      "Comparable inspector-general removals",
      "Comparable enforcement settlements across administrations"
    ],
    "comparison_notes": "Temporal convergence is a research signal, not a substitute for controls or particular-matter evidence. Proposal, appropriation, obligation, outlay, and final-actual stages must remain separate."
  },
  "institutional_response": {
    "judicial_status": "Matter-specific court dispositions require docket-level verification; the SEC settlement was reported as unapproved in May 2026.",
    "administrative_status": "Multiple matters are reported as dismissed, paused, reduced, or affected by personnel changes; claim-level primary records remain incomplete.",
    "legislative_status": "Congressional conflict-of-interest inquiries and subpoena-capable review remain potential accountability paths.",
    "oversight_status": "Waiver, recusal, inspector-general, and internal decision records remain unresolved.",
    "injunctions": [],
    "stays": [],
    "dismissals": ["SpaceX hiring-discrimination dismissal requires installed court receipt"],
    "remands": [],
    "settlements": ["SEC proposed $1.5 million settlement reported in May 2026; approval status requires current docket verification"],
    "reversals": [],
    "pending_reviews": [
      "Primary-record acquisition",
      "Current docket verification",
      "Control comparison",
      "Independent governance review"
    ],
    "no_challenge_found": false
  },
  "outcome_evidence": {
    "measured_outcomes": [
      "No DOGE realized-savings measure is promoted; the official Treasury reporting collection is identified but exact comparable period values remain uninstalled"
    ],
    "claimed_outcomes": [
      "DOGE claimed savings and fraud-reduction benefits",
      "The narrative assessment claims aggregate federal spending increased and Musk-related exposure was broadly reduced"
    ],
    "projected_outcomes": [],
    "contradicted_outcomes": [
      "Aggregate spending growth may contradict a broad net-budget-reduction claim but does not alone measure program-specific savings",
      "The FY2026 presidential budget proposal cannot be used as evidence of enacted or actual spending"
    ],
    "no_measurable_effect_yet": false,
    "harm_documented": [],
    "benefit_documented": [],
    "insufficient_evidence": true
  },
  "ledger_classification": {